book_name,book_code,chapter,question_number,question,option_a,option_b,option_c,option_d,correct_option,difficulty
1Kings01,1K,16,32,How was the reign of Omri characterized (1 Kgs 16:25)?,He did what was right in the eyes of the Lord,He offered his children  up to Chemosh god of the Moabites,"He sinned more than all those before him  
174",He ran after Baal and Asherah,C,B
1Kings01,1K,16,33,In whose ways did Omri king of Israel walk (1 Kgs 16:26)?,David his father,Jeroboam son of Nebat,Ben-Hadad king Ar am,Abimelech king of Philistia,B,B
1Kings01,1K,16,34,Where was Omri buried (1 Kgs 16:28)?,Tirzah,Shechem,Bethel,Samaria,D,B
1Kings01,1K,16,35,Who succeeded Omri on the throne of Israel (1 Kgs 16:28)?,Ahab,Elah,Jehu,Jehoahaz,A,B
1Kings01,1K,16,36,Who was king in Judah when Ahab became king (1 Kgs 16:29)?,Abijah,Jehoshaphat,"Asa 
175",Amaziah,C,B
1Kings01,1K,16,37,How many years did Ahab rule over Israel (1 Kgs 16:29)?,7,15,22,31,C,A
1Kings01,1K,16,38,How was the reign of Ahab characterized (1 Kgs 16:30)?,He did what was evil in the eyes of the Lord,He offered his children up to Chemosh god of the Moabites,He sinned more than all those before him,He ran after Baal and Asherah,C,B
1Kings01,1K,16,39,What did Ahab consider trivial (1 Kgs 16:31)?,To put to death the prophets of the Lord,To commit the sins of Jeroboam son of Nebat,To build Asherah poles on all the high places,To make an alliance with Aram,B,I
1Kings01,1K,16,40,Who did Ahab marry (1 Kgs 16:31)?,Milcah,Jezebel,"Tamar  
176",Maacah,B,B
1Kings01,1K,16,41,Who was the father of Jezebel (1 Kgs 16:31)?,Ethbaal king of the Sidonians,Sihon king of Heshbon,Amraphael king of nations,Ben-Hadad king of Aram,A,I
1Kings01,1K,16,42,In the rei gn of Ahab they began to worship and serve what god (1 Kgs 16:31)?,Chemosh,Moloch,Dagon,Baal,D,B
1Kings01,1K,16,43,What temple did Ahab build in Samaria (1 Kgs 16:32)?,Baal,The golden calves,Chemosh,Moloch,A,B
1Kings01,1K,16,44,What did Hiel of Bethel rebuild in the time of Ahab (1 Kgs 16:34)?,Gilgal,Gibeon,"Jericho  
177",Anathoth,C,I
1Kings01,1K,16,45,What happened when Hiel of Bethel rebuilt the foundations of Jericho (1 Kgs 16:34)?,His wife died,His firstborn died,His younger son died,He was smitten with leprosy,B,B
1Kings01,1K,16,46,When did Hiel of Bethel loose his younger son Segub (1 Kgs 16:34)?,When he laid the foundation of Jericho,When he finished the walls of Jericho,When he built the palace in Jeric ho,When he set up the gates of Jericho,D,A
1Kings01,1K,16,47,"When Hiel of Bethel lost his sons as he rebuilt Jericho it fulfilled the word of the 
Lord spoke by ________ (1 Kgs 16:34)?",Joshua son of Nun,Elijah the Tishbite,Ahijah the Shilonite,The man of God out of Judah,A,B
1Kings01,1K,17,1,Elijah was from what area (1 Kgs 17:1)?,Tekoa in Judah,Tishbe in Gilead,Jezreel in Galilee,Gerizim in Ephraim,B,I
1Kings01,1K,17,2,Who was the king that Elijah addressed (1 Kgs 17:1)?,Omri,Baasha,Elah,Ahab,D,B
1Kings01,1K,17,3,What did Elijah announce would not happen except by his word (1 Kgs 17:1)?,Harvest of wheat and barley,Dew or rain,The Lord’s blessings,Prosperity  and security in Israel,B,B
1Kings01,1K,17,4,"Where was Elijah to hide after having announced a drought on Ahab and Israel (1 Kgs 
17:3)?",Wadi Qelt east of Jerusalem,The Arnon canyon on the other side of the Jordan,"The spring of Harod in the Jezreel val ley 
179",The Kerith Ravine east of the Jordan,D,B
1Kings01,1K,17,5,How did God feed Elijah when he was at the Kerith brook (1 Kgs 17:3)?,With sheep and goats,The ravens brought him food,A woman brought him food,He stayed with a family there,B,B
1Kings01,1K,17,6,What did the ravens bring Elijah when he was at the Kerith Ravine (1 Kgs 17:6)?,Bread and meat,Wine and bread,Fruits and vegetables,Manna and wine,A,I
1Kings01,1K,17,7,"After Elijah was at the Kerith Ravine why did he have to move from there (1 Kgs 
17:7)?",Ahab was pursuing him,He had to bring a message to Israel,The stream dried up,The ravens ran out of food to bring him,C,I
1Kings01,1K,17,8,After the Kerith Ravine where did God guide Elijah during the drought (1 Kgs 17:9)?,Gilgal,"Bethel  
180",Shiloh,Zarephath,D,I
1Kings01,1K,17,9,Zarephath was located in what region (1 Kgs 17:9)?,Jezreel,Gilead,Sidon,Jordan,C,I
1Kings01,1K,17,10,"How did God tell Elijah he would get food when he arrived at Zarephath (1 Kgs 
17:10)?",The king of Sidon would take care of him,A widow would feed him,The ravens would feed him,He was to fish in the ocean there,B,B
1Kings01,1K,17,11,What was the widow of Zarephath doing when Elijah met her (1 Kgs 17:10)?,Drawing water from the well,Threshing wheat,Cooking in her home,Gathering sticks,D,A
1Kings01,1K,17,12,"What did Elijah request from the widow of Zarephath when he first met her (1 Kgs 
17:11)?","Bread and water  
181",Oil and figs,Olives and bread,Bread and w ine,A,I
1Kings01,1K,17,13,"While the widow of Zarephath had no water or bread what did she tell Elijah she did 
have (1 Kgs 17:12)?",A basket of olives and figs,A jug of oil and a handful of flour,A skin of wine and a jar of barley,A leg of lamb and  skin of milk,B,I
1Kings01,1K,17,14,Why was the widow of Zarephath gathering sticks (1 Kgs 17:12)?,To make a fire to keep warm,To build a roof for her house,To cook a last meal for her son,To bring the palace to trade for some food,C,B
1Kings01,1K,17,15,"What did Elijah request from the widow of Zarephath after she told him she only had 
oil and flour (1 Kgs 17:14)?",He wanted her to make him a small cake,He wanted her to bake him some bread,He wanted oil to refresh himself with,He wanted her to sell everything she had and follow him,A,I
1Kings01,1K,17,16,"What did Elijah tell the widow of Zarephath would not happen until they got rain (1 
Kgs 17:14)?",She would find a silver coin she could use for food at the gate of the city,She sh ould bake bread for her neighbors and give it away,The birds would bring she and her son food,Her jar of flour and jug of oil would not run dry,D,B
1Kings01,1K,17,17,What did the widow of Zarephath say to Elijah after her son died (1 Kgs 17:18)?,"May the Lord look upon me and judge you for the evil you have brought on 
my son",I gave you food and water and this is how you repay your friends,Did you come here to remind me of my sin and kill my son,Did you bring a curse on this house instead  of a blessing,C,B
1Kings01,1K,17,18,Where did Elijah take the boy from his mother’s arms (1 Kgs 17:19)?,To the upper room,To the city gate,To the roof of the house,To the place where they had made bread for Elijah,A,A
1Kings01,1K,17,19,"What did Elijah do to bring the widow of Zarephath’s son back to life after praying to 
God (1 Kgs 17:21)?",He opened the window and prayed to God three times,He laid hands on the boy and anointed him with oil,"He told his mother to breath into the boy’s nostril s three times  
183",He stretched himself on top of the boy three times,D,B
1Kings01,1K,17,20,How did the widow of Zarephath’s son come back to life (1 Kgs 17:22)?,The Lord heard Elijah’s cry,He was merely asleep and not dead so Elijah woke him,Elijah breathed into his mouth three times,Elijah touched him with a hot iron causing him to come alive,A,B
1Kings01,1K,17,21,"After Elijah brought the widow of Zarephath’s son back to life she said that she now 
knew Elijah was a man of God and ______ (1 Kgs 17 :24)",Death has no sting,The word of the Lord from his mouth was true,That God listened to Elijah,The Lord God was compassionate and his mercy extends to all,B,I
1Kings01,1K,18,1,"After how many years did the Lord finally tell Elijah to go and tell Ahab the Lord 
would send rain (1 Kgs 18:1)?",1,2,3,5,C,I
1Kings01,1K,18,2,"Who did the Lord tell Elijah to present himself to when the Lord had decided to send 
rain after a multi -year drought (1 Kgs 18:1)?",Baasha,Omri,Zimri,Ahab,D,B
1Kings01,1K,18,3,What role did Obadiah play among Ahab’s officials (1 Kgs 18:3)?,He was a palace administrator,He was the recorder for the kingdom,He was the captain of the g uard,He was the king’s advisor,A,I
1Kings01,1K,18,4,What was noted about Obadiah Ahab’s palace administrator (1 Kgs 18:4)?,He was one of the prophets of Baal,He was a priest of the altar of Baal at Samaria,"He was a believer in the Lord  
185",He was the guard who oversaw the killing of the Lord’s prophets,C,B
1Kings01,1K,18,5,What had Obadiah done in the reign of Ahab and Jezebel (1 Kgs 18:4)?,He had served the Lord by cutting down the Asherah pole in Samaria,He had hidden 100 prophets of the Lo rd in two caves,"He had hidden Elijah on the roof of his house when Ahab was trying to kill 
him",He had smuggled many priests and Levites down to Jerusalem,B,B
1Kings01,1K,18,6,"What task had Ahab ordered Obadiah to do during the three year drought (1 Kgs 
18:5)?",Find some grass at the springs around Israel to keep the horses alive,Take a number of camels to haul water up from the Jordan River,Go to Phoenician and buy food for those of the palace in Samaria,Find Elijah so that Ahab could kill him and end the drought,A,I
1Kings01,1K,18,7,"Who searched the land for grass for the horses and mules along with Obadiah during 
the three year drought (1 Kgs 18:6)?",Elihu,Naboth,Elijah,Ahab,D,A
1Kings01,1K,18,8,"Who did Obadiah, Ahab’s palace administrator  meet as he was searching for grass for 
the king’s horses (1 Kgs 18:7)?  
186",Naboth,The prophets of Baal,Elijah,Ahab,C,B
1Kings01,1K,18,9,Why was Obadiah scared when he met Elijah (1 Kgs 18:12)?,Elijah was headed to Samaria where Ahab was going to try to kill him,The Spirit may carry Elijah off and Ahab would kill Obadiah,Elijah had a bounty on his head for killing the prop hets of Baal,Elijah had threatened that his son would die,B,B
1Kings01,1K,18,10,"Obadiah told Elijah that Ahab had been doing what during the three year drought (1 
Kgs 18: 10)?",Planning how to kill Elijah as one of the prophets of the Lord,Digging a well in Samaria to get water,Made an alliance with the king of Aram to supply Samaria with food,"Hunting for Elijah sending out people to look for him even in foreign 
countries",D,I
1Kings01,1K,18,11,Why did Obadiah tell Elijah Ahab might kill him (1 Kgs 1 8:12)?,If he says he’s found Elijah and the Spirit carries him off,If he tells Ahab there are still some prophets of the Lord alive,If he tells Ahab it is because of him that there was a drought,If he says he cannot find sources of water  for the horses to drink,A,B
1Kings01,1K,18,12,Who did Obadiah say had killed prophets of the Lord (1 Kgs 18:13)?,Ahab,Jezebel,Jehu,Rezin,B,B
1Kings01,1K,18,13,Where did Obadiah hide one hundred prophets of the Lord (1 Kgs 18:13)?,On the roof of the palace,In the forest of Ephraim,In a field in Sidon,In two caves,D,B
1Kings01,1K,18,14,"What was Elijah’s solution to the objection of Obadiah that if he told Ahab he had 
found Elijah Ahab would kill him (1 Kgs 18:14)?",Elijah promised him the Lord would not let him be harmed,Elijah told him to tell Ahab to meet him at Mount Gilboa,Elijah said he would present himself to Ahab,Elijah said Ahab would be dead within two months,C,I
1Kings01,1K,18,15,"Of what did Ahab accuse Elijah in their meetin g that had been arranged by Obadiah 
(1 Kgs 18:16)?",You man of terror and destruction,You troubler of Israel,You prophet of vanity,"You friend of Judah  
188",B,B
1Kings01,1K,18,16,Why did Elijah tell Ahab he was the troubler of Israel (1 Kgs 18:18)?,Because he abandoned the Lord’s commands and followed the Baals,Because he killed the prophets of the Lord and worshipped the calves,Because he had married Jezebel the daughter of the king of Sidon,Because he had hardened his heart against the Lord God of Israel,A,B
1Kings01,1K,18,17,Where did Elijah tell Ahab to meet him with the prophets of Baal (1 Kgs 18:19)?,On Mount Gilboa,On the Mount of Olives,On Mount Gerizim,On Mount Carmel,D,B
1Kings01,1K,18,18,How many prophets of Baal and Asherah at e at Jezebel’s table (1 Kgs 18:19)?,380,450,850,1000,C,A
1Kings01,1K,18,19,What two groups of false prophets ate at the table of Jezebel (1 Kgs 18:19)?,Prophets of Dagon and Baal,Prophets of Baal and Asherah,Prophets of Chemosh and Moloch,"Prophets of Baal and the golden calves  
189",B,B
1Kings01,1K,18,20,What challenge lay down on Mount Carmel (1 Kgs 18:21)?,If you will repent of your sins the Lord will forgive,If you return the Lord will restore prosperity to Israel,"If the Lord is God, follow him; if Baal is God, follow him",If you will break the commands of the Lord then there will be no rain,C,B
1Kings01,1K,18,21,What did Elijah tell the people gathered on Mount Carmel (1 Kgs 18:21)?,How long will you waver between  two opinions,How long will you reject the Lord your God,When will you return to the Lord who brought you out of Egypt,How long will you serve Baal and Asherah,A,B
1Kings01,1K,18,22,"What was the people’s response to Elijah’s challenge on Mount Carmel ( 1 Kgs 
19:21)?",They tore their clothes and threw dust on their heads,They picked up stones to stone him,They said “We will follow Baal the rider of the clouds”,They said nothing,D,I
1Kings01,1K,18,23,How many prophets of Baal were on Mount Carmel o pposing Elijah (1 Kgs 18:22)?,350,400,"450 
190",500,C,I
1Kings01,1K,18,24,What test did Elijah arrange to prove which god was God (1 Kgs 18:23ff)?,Two bulls on two separate altars and the god who answers by fire is God,Two altars set up and the god that caused it to rain is God,Two tree pillars set up and the one that was struck by fire was God,"Two altars were built when the sacrifice was made if the ground shook that 
would prove which one was God",A,B
1Kings01,1K,18,25,What did the prophets o f Baal do until noon on Mount Carmel (1 Kgs 18:26)?,They cut themselves and jumped on the altar,They set up an Asherah pole beside the altar,They called on the name of Baal and danced around the altar,They burned their hands and feet with  fire screaming for Baal to act,C,B
1Kings01,1K,18,26,What did Elijah do to the prophets of Baal at noon (1 Kgs 18:27)?,He turned his back on them,He began to taunt them,He asked if he could help them,He said nothing,B,B
1Kings01,1K,18,27,Who said “Surely he [Baal] is a god” (1 Kgs 18:27)?,Ahab,"The prophets of Baal  
191",Jezebel,Elijah,D,B
1Kings01,1K,18,28,"Elijah told the prophets to shout louder for all of the following reasons EXCEPT (1 
Kgs 18:27)?",Perhaps Baal was sleeping and needed waking,Perhaps Baal was hard of hearing,Perhaps he was traveling,Perhaps he was in deep thought,B,I
1Kings01,1K,18,29,"What did the prophets of Baal do as they were shouting for Baal to respond with fire 
(1 Kgs 18:28)?",They threw dust into t he air,They hit the sacrificial bull with their spears and swords,They slashed themselves until the blood flowed,They raised their hands to heaven and dropped to their knees,C,B
1Kings01,1K,18,30,How long did the prophets of Baal continue their franti c prophesying (1 Kgs 18:29)?,Three days and three nights,Until noon,Until the sun went down,Until the time for evening sacrifice,D,A
1Kings01,1K,18,31,"Elijah did all of the following before he offered the sacrifice on Mount Carmel 
EXCEPT (1 Kgs 18 :30ff)  
192",Dug a trench around the altar,Used twelve stones to buil d the altar of the Lord,Cut the bull and laid it on the wood,Held up his staff as he prayed,D,B
1Kings01,1K,18,32,"What did Elijah do three times when he was on Mount Carmel confronti ng the 
prophets of Baal (1 Kgs 18:33f)?",Raised his hands to heaven,Poured water on the offering and wood,Wrote in the dust of the ground the crimes of Israel,Mocked the prophets of Baal,B,B
1Kings01,1K,18,33,"Elijah on Mount Carmel prayed that God show that he was God in Israel and that 
______ (1 Kgs 18:36)",There is no other,That the prophets of Baal are false prophets,That Elijah was his servant,That Baal is no god at all,C,I
1Kings01,1K,18,34,"What did Elijah pray would happen to the  people seeing God lighting the fire on 
Mount Carmel (1 Kgs 18:37)?",That the people’s hearts would be turned back again,That Ahab would be shown to be evil,That the people would kill the prophets of Baal,"That the people would realize Baal  was no god  
193",A,B
1Kings01,1K,18,35,"When the fire of the Lord fell on the altar at Mount Carmel all of the following were 
burned up EXCEPT",The soil,The water in the trench,The stones,"The prophets of Baal  
 E. The wood",D,B
1Kings01,1K,18,36,"What did Elijah ord er after fire fell from heaven on the altar on Mount Carmel (1 Kgs 
18:40)?",Seize the prophets of Baal,Break down the altar of Baal,Burn the Asherah pole,Worship the Lord their God with all their hearts,A,B
1Kings01,1K,18,37,Where did Elijah order t he prophets of Baal be taken to be slain (1 Kgs 18:40)?,The Jezreel Valley,The Kidron Valley,The Kishon Valley,The Valley of Arnon,C,A
1Kings01,1K,18,38,"What did Elisha tell Ahab to do immediately after fire fell from heaven on the altar on 
Mount Carmel (1 Kgs 18:41)?","Flee for his life  
194",Go eat and drink,Gather up the bodies of the prophets of Baal,Go an report what happened to Jezebel,B,A
1Kings01,1K,18,39,What did Elijah do after fire fell from heaven on Mount Carmel (1 Kgs 18:42)?,He bowed his head and prayed,He ate and drank,He put his face between his knees,He raised his hands to the Lord,C,I
1Kings01,1K,18,40,"After fire fell from heaven on Mount Carmel what did Elijah tell his servant to do (1 
Kgs 18:43)?",To go back  to the palace and report what had happened,To destroy the altar built in honor of Baal,To bring water for Elijah to wash his hands,To go look toward the sea,D,I
1Kings01,1K,18,41,How many times did Elijah tell his servant to look toward the sea (1 K gs 18:43)?,3,7,9,12,B,A
1Kings01,1K,18,42,"On the seventh time what did Elijah’s servant sea over the sea (1 Kgs 18:44)?  
195",A cloud rising like a man’s hand,The sky grew clear as crystal,Hail mixed with fire,The angels appearing riding chariots,A,B
1Kings01,1K,18,43,When the cloud appeared what did Elijah tell Ahab to do (1 Kgs 18:44)?,Burn up the wood that was on the altar of Baal,Turn to the Lord who made heaven and earth,Hitch up his chariot and go down before t he rain stops him,Run for his life as the next fire from heaven may be on him,C,B
1Kings01,1K,18,44,"After Ahab rode off in his chariot from Mount Carmel what did Elijah do (1 Kgs 
18:46)?",He fled into the wilderness of Ephraim,Tucked his cloak into his  belt and ran ahead of Ahab,He told Ahab that Jezebel would die,He told his servant to prepare a meal for him,B,B
1Kings01,1K,18,45,"Elijah ran from Mount Carmel in front of Ahab’s chariot all the way to ______ (1 
Kgs 18:46)?",Gilboa,Shechem,Tirzah,Jezreel,D,I
1Kings01,1K,19,1,"What did Ahab specifically tell Jezebel about after the Mount Carmel situation (1 Kgs 
19:1)?",How the prophets of Baal were defeated by Elijah,How the proph ets of Baal were slain by Elijah,How it finally rained at the command of Elijah,How the Lord had sent fire down from heaven,B,B
1Kings01,1K,19,2,"What was Jezebel’s response to the fact that Elijah had slain the prophets of Baal (1 
Kgs 19:2)?",She screamed at Ahab for allowing Elijah to kill the prophets of Baal,She ordered the captain of the guard to bring Elijah to her,She remained silent until the evening,She threatened to kill Elijah by the next day,D,B
1Kings01,1K,19,3,What was Elijah’s r esponse to Jezebel’s threat to kill him (1 Kgs 19:3)?,He was afraid and ran for his life,He hid in the cave of Obadiah the palace administrator,He prayed to the Lord for protection,He warned Jezebel that the Lord was on his side,A,B
1Kings01,1K,19,4,Where was the first stop given in the text in Elijah’s flight from Jezebel (1 Kgs 19:3)?,Megiddo,Shechem,"Jerusalem  
198",Beersheba,D,I
1Kings01,1K,19,5,"In his flight from Jezebel where did Elijah sit down out in the desert by Beersheba (1 
Kgs 19:4)?",Under an oak tree,Beside a stream,By a well,Under a broom tree,D,B
1Kings01,1K,19,6,"What did Elijah pray as he sat under the broom tree in the desert of Beersheba (1 Kgs 
19:4)?","Have mercy on me, O Lord","Take my life, I am no better than my ancestors",Hide my in the hollow of your hand from this wicked woman,I can no longer speak the word of the Lord,B,B
1Kings01,1K,19,7,After Elijah prayed for death under the broom tree what did he do next (1 Kgs 19:5)?,Drank some wine,Sent a message  back to Ahab,Fell asleep,Told his servant to return to Jerusalem,C,I
1Kings01,1K,19,8,What did the angel by the broom tree tell Elijah to do (1 Kgs 19:5)?,Get up and eat,"Return to Israel  
199",Send a message from the Lord to Ahab,To put on a n ew cloak and sandals for a journey,A,I
1Kings01,1K,19,9,When the angel woke Elijah up what did Elijah see (1 Kgs 19:6)?,A lamb roasting on the fire,Some baked bread over hot coals,A skin of wine,An altar of the Lord,B,I
1Kings01,1K,19,10,Why did the angel  tell Elijah to eat a second time (1 Kgs 19:7)?,He would need the strength to face Ahab and Jezebel,The angel was going to take him to a place he did not know,The journey would be too much for him,The Lord was concerned about him,C,A
1Kings01,1K,19,11,"It took Elijah 40 days to travel from the broom tree by Beersheba to what location (1 
Kgs 19: 8)?",To Jerusalem and the temple,To Horeb the mountain of God,To the Jordan River,To Egypt,B,B
1Kings01,1K,19,12,Where did Elijah spend the night at Mount Horeb (1 Kgs 19:9)?,"In a tent  
200",On the sand,In the house of a widow,In a cave,D,A
1Kings01,1K,19,13,"How many days did it take Elijah to get from the broom tree by Beersheba down to 
Horeb the mountain of God (1 Kgs 19:8)?",3 days,7 days,12 days,40 days,D,B
1Kings01,1K,19,14,When Elijah arrived at Horeb what did the Lord say to him (1 Kgs 19:9)?,What are you doing here?,Why are you so afraid of Jezebel?,What do you want me to give you?,Why has Israel not kept its commandme nt?,A,B
1Kings01,1K,19,15,"Elijah, at Horeb, complains to the Lord about all of the following EXCEPT (1 Kgs 
19:10)",The prophets have been put to death by the sword,Israel has broken the covenant,There is no one righteous in Israel,They have broken down the Lord’s altar,C,B
1Kings01,1K,19,16,"When Elijah came out to stand on the mountain of the Lord all of the following 
happened and the Lord was not in it EXCEPT (1 Kgs 19:11f)",Wind,Rain,Earthquake,Fire,B,B
1Kings01,1K,19,17,How did Elijah approach God at the entrance of the cave (1 Kgs 19: 13)?,He turned his face backwards as he approached the opening,He closed his eyes as the light blinded him,He put his hands over his face,He pulled his cloak over his face,D,B
1Kings01,1K,19,18,"Elijah expressed his lament to the Lord at Mount Horeb for all of the following 
reasons EXCEPT (1 Kgs 19:14)?",The Israelites had broken down God’s altars,The Israelites had violated God’s covenant,The Israelites had killed the pr ophets,"The Israelites had defiled the land with their idols  
 E. He was the only one left and they were trying to kill him",D,B
1Kings01,1K,19,19,From Mount Horeb where did God tell Elijah to go next (1 Kgs 19:15)?,The Jezreel Valley,Samaria,"The de sert of Damascus  
202",The hill country of Ephraim,C,A
1Kings01,1K,19,20,"What was Elijah instructed to do when he got to the Desert of Damascus (1 Kgs 
19:15)?",Anoint Hazael king over Aram,Anoint Rezin king of Tyre,Prophecy against Damascus telling them to repent,Strike the ground there three times,A,B
1Kings01,1K,19,21,"Elijah was instructed at Mount Horeb to anoint all of the following EXCEPT (1 Kgs 
19:15f)",Hilikiah as priest at Bethel,Hazael king of Aram,Jehu king of Israel,Elisha to succeed him as prophet,A,B
1Kings01,1K,19,22,Who will Jehu put to death (1 Kgs 19:17)?,The house of Baasha,Any who escape the sword of Hazael,The prophets of Baal,The priests of Bethel,B,I
1Kings01,1K,19,23,"How many did God tell Elijah had not bowed the k nee to Baal in Israel (1 Kgs 
19:18)?","5,000  
203","7,000","10,000","12,000",B,B
1Kings01,1K,19,24,What was Elisha doing when Elijah first found him (1 Kgs 19:19)?,Hiding in a cave from Ahab,Standing in the gate of Jezreel,Plowing with twelve yoke  of oxen,Harvesting almonds from his father’s almond trees,C,I
1Kings01,1K,19,25,What did Elijah do initially to Elisha as he was plowing (1 Kgs 19:19)?,Anointed him with oil,Told him God had designated him as a prophet,Kissed and embraced him,Threw his cloak around him,D,I
1Kings01,1K,19,26,"What one request did Elisha make when Elijah called him as he was plowing (1 Kgs 
19:20)?",To kiss his father and mother good -bye,To wait for one more harvest,That it rain on the crops he was now planting,That Elijah come home with him,A,A
1Kings01,1K,19,27,"What did Elisha do just before he began to follow Elijah (1 Kgs 19:21)?  
204",He sold his family inheritance giving his portion to his brothers,He slaughtered his oxen and bu rned the plowing equipment,He announced from the walls of Jezreel that God was calling him,He went and gathered all the food and water he could carry,B,B
1Kings01,1K,19,28,Who became Elijah’s attendant (1 Kgs 19:21)?,Hananiah,Uriah,Ahikam,Elisha,D,B
1Kings01,1K,20,1,Who attacked Samaria accompanied by 32 kings (1 Kgs 20:1)?,Rezin,Esarhaddon,Necho,Ben-Hadad,D,B
1Kings01,1K,20,2,Ben -Hadad who attacked Samaria was king over what country (1 Kgs 20:1)?,Moab,Aram,Edom,Assyria,B,B
1Kings01,1K,20,3,"Ben -Hadad claimed that all of the following from Samaria were his EXCEPT (1 Kgs 
20:2)?",Gold,Best of your wives,Best of your children,Best of your horses,D,A
1Kings01,1K,20,4,Who was king of Israel when Ben -Hadad of Aram attacked Samaria (1 Kgs 20:2)?,Omri,Ahab,"Jehoram  
206",Nadab,B,B
1Kings01,1K,20,5,"When Ben -Hadad asked for Ahab’s wives, children and gold how did Ahab respond (1 
Kgs 20:4)?",Prepare for batt le,Let not Ben -Hadad demand what is not his,All I have is yours,This shall never be,C,I
