book_name,book_code,chapter,question_number,question,option_a,option_b,option_c,option_d,correct_option,difficulty
Questions,2S,10,6,"Where did David tell his humiliated men to go until their beards had grown back in (2 
Sam 10:5)?",Beth el,Gilgal,En Gedi,Jericho,D,B
Questions,2S,10,7,"When the Ammonites realized they had offended David by shaming his delegation 
what did they do (2 Sam 10:6)?",They hired mercenaries to help fight David,They set up an ambush for David’s army,They sounded the trumpet for war with Israel,They sent men to spy out David’s troops and movements,A,B
Questions,2S,10,8,"When the Ammonized realized they were a stench to David they hired mercenaries 
from all of the following EXCEPT (2 Sam 10:6)?","King Maacah, 1,000 men","Aramean foot soldiers from Beth Rehob and Zobah, 20,000 men","Men of Edom, 8,000","Men from Tob, 12,000 men",C,A
Questions,2S,10,9,"How did David respond when he heard that Hanun the Ammonite was assembling an 
army against him (2 Sam 10:7)?",David fortified all the cities of Israel,David sent Joab and his entire army out,David sent a letter to Hanun warning him not to attack,David led Israel out to battle against Hanun,B,B
Questions,2S,10,10,"When the Ammonites drew up in battle formati on where did they fight from (2 Sam 
10:8)?",The entrance of the city gate,By the wall in the valley,By the spring of Heshbon,In the open field,A,A
Questions,2S,10,11,Where the Arameans engage Joab in battle (2 Sam 10:8)?,The entrance of the city  gate,By the wall in the valley,"By the spring of Heshbon  
77",In the open field,D,A
Questions,2S,10,12,"Joab selected the best fighters in Israel to fight with him against the ______ (2 Sam 
10:9)?",Edomites,Ammonites,Arameans,Babylonians,C,I
Questions,2S,10,13,"Who did Joab select to head the troops to fight directly against the Ammonites [Hint 
Joab’s brother] (2 Sam 10:10)?",Abishai,Benaiah,Abner,Hezron,A,I
Questions,2S,10,14,Before Joab engaged in battle against the Ammonites wh at did he say (2 Sam 10:12)?,We are stronger than lions and fiercer than bears,The Lord will do what is good in his sight,Remember what David did to Goliath,The battle is the Lord’s,B,B
Questions,2S,10,15,When in battle with Hanun who fled before J oab (2 Sam 10:13)?,The Edomites,"The Ammonites  
78",The Arameans,The Philistines,C,I
Questions,2S,10,16,When in battle with Hanun who fled before Abishai (2 Sam 10:13)?,The Edomites,The Ammonites,The Arameans,The Philistines,B,I
Questions,2S,10,17,"To where did the Ammonites flee from Abishai after Joab routed the Arameans (2 
Sam 10:14)?",Into the city,Onto the top of Mount Pisgah,Into a canyon,To the threshingfloor of Nacon,A,A
Questions,2S,10,18,"After Joab defeated the Arameans where did Hadadezer get fresh troops from (2 Sam 
10:16)?",From Damascus,From the Hittites,From beyond the River (Euphrates),From Zobah,C,A
Questions,2S,10,19,"Who was the leader regrouping the Arameans after they were defeated by Joab (2 
Sam 10:16)?  
79",Nahas h,Shobach,Elhanan,Hadadezer,D,I
Questions,2S,10,20,"Who was Hadadezer’s commander who led the armies of the Arameans after Joab 
had defeated them (2 Sam 10:16)?",Nahash,Shobach,Elhanan,Rezon,B,A
Questions,2S,10,21,"Where did David go to fight the Arameans after gathering all Israel and crossing the 
Jordan River (2 Sam 10:17)?",Ugarit,Damascus,Helam,Heshbon,C,A
Questions,2S,10,22,How many charioteers of the Arameans did David kill (2 Sam 10:18)?,300,700,"1,000","5,000",B,A
Questions,2S,10,22,How many foot soldiers did the Arameans loose to David at Helam (2 Sam 10:18)?,"25,000","32,000","38,000","40,000",D,A
Questions,2S,10,23,"After their defeat at Helam who were afraid to help the Ammonites anymore (2 Sam 
10:19)?",The Ed omites,The Arameans,The Hittites,The Egyptians,B,B
Questions,2S,11,1,In what season did kings of Israel traditionally go to war (2 Sam 11:1)?,Winter,Spring,Summer,Fall,B,B
Questions,2S,11,2,"Who did David send out leading the Israelite army while he stayed in Jerusalem (2 
Sam 11:1)?",Benaiah,Abiathar,Joab,Amnon,C,B
Questions,2S,11,3,"Against what city was Joab attacking when David remained in Jerusalem and the 
Bathsheba incid ent happened (2 Sam 11:11)?",Heshbon,Jabesh Gilead,Gerasa,Rabbah,D,B
Questions,2S,11,4,"Against what tribal group was Joab going against when David remained in Jerusalem 
and the Bathsheba incident happened (2 Sam 11:11)?",Ammonites,"Edomites  
82",Moabites,Philistines,A,B
Questions,2S,11,5,Where was David when he first saw Bathsheba (2 Sam 11:2)?,At a well,On the roof top,In the city gate,On his throne,B,B
Questions,2S,11,6,What was Bathsheba doing when David first saw her (2 Sam 11:2)?,Buying food,Carrying water,Bathing,Standing in the city gate,C,B
Questions,2S,11,7,How did the man David sent to find out about Bathsheba identify her (2 Sam 11:3)?,As the wife of Uriah the Hittite,As the daughter of Nahash,As the mother of Eliab,As a woman from Jabesh Gilead,A,B
Questions,2S,11,8,"What does the text note Bathsheba had done prior to sleeping with David (2 Sam 
11:4)?","She had left her children at home  
83",She had put on perfume,She had purified herself,She ha d covered her face,C,B
Questions,2S,11,9,Who was Bathsehba’s husband (2 Sam 11:3)?,Shammah the Harodite,Abiezer the Moabite,Eliam the Gilonite,Uriah the Hittite,D,B
Questions,2S,11,10,What word did Bathsheba send back to David (2 Sam 11:5)?,She was m arried,She was pregnant,He had pleased her,She was sick,B,B
Questions,2S,11,11,What did David do after Bathsheba told David she was pregnant (2 Sam 11:6)?,He sent for Uriah to come back to Jerusalem,He told Joab to kill Uriah while they were in battle,He sought counsel from Hushai his chief sage,He tried to ignore it,A,B
Questions,2S,11,12,To whom did David send word to send Uriah back to Jerusalem (2 Sam 11:6)?,"Benaiah  
84",Abiathar,Joab,Hushai,C,B
Questions,2S,11,13,When Uriah returne d to Jerusalem what did David ask him (2 Sam 11:7)?,How his wife was?,How the battle was going?,How Rabbah could be defeated,How he as a Hittite came to Israel,B,B
Questions,2S,11,14,After interviewing Uriah what did David tell Uriah to do (2 Sam 11 :8)?,Go to his house and wash his feet,Go to his wife and enjoy the night,Go home and greet his family,Have a banquet with his family,A,A
Questions,2S,11,15,Where did Uriah sleep after returning from the front lines to Jerusalem (2 Sam 11:9)?,At the city gate,On the rough of the palace,At the entrance to the palace,At the Gihon spring,C,B
Questions,2S,11,16,Why did Uriah tell David he could not go home (2 Sam 11:11)?,"Because his garments were stained from the battle  
85",Because the ark and Israel and Judah are staying in tents,Because the battle was raging and he needed to be there,"Because Joab had told all the men not to sleep with women until the battle 
was won",B,B
Questions,2S,11,17,"After the first night when Uriah wouldn’t go home wha t did David do with Uriah the 
second day (2 Sam 11:13)?",Brought Bathsheba up to the palace,Ordered Uriah to go home,Had his servants take Uriah home,Got him drunk at dinner,D,B
Questions,2S,11,19,To whom did David send the letter ordering Uriah’s death (2 Sam 11:14)?,Abishai,Abiathar,Joab,Elishammah,C,B
Questions,2S,11,20,"Why did Joab think that David would get mad about the way he was executing the 
war against Rabba h (2 Sam 11:20)?",Because they entered by the city gate,Because they got too close to the city wall,Because they did not break through the city wall,Because they did not capture the spring that supplied water to the city,B,I
Questions,2S,11,21,How was Abimelech son of Jerub -Basheth killed at Thebez (2 Sam 11: 21)?,A woman threw a millstone on him from the wall,A archer shot him from the wall,A soldier poured boiling oil on him from the wall,He was ambushed as he went through the city gate,A,B
Questions,2S,11,22,"The messenger sent from Joab to David in the Uriah situation told David how did 
some of David’s men die (2 Sam 11:24)?",The people on the wall dropped a millstone on them,The people in the city gate poured hot oil on them,The people on the city wall shot them with arrows,They were stabbed with the sword in the open field,C,I
Questions,2S,11,23,What proverb did David use to console Joab after Uriah was killed (2 Sam 11:25)?,A random arrow kills a random soldier,God alone giv es and takes life,A valiant warrior gives his life for his country,"The sword devours one as well as another  
87",D,I
Questions,2S,11,24,"What was Bathsheba’s response when she heard of the death of her husband Uriah (2 
Sam 11:26)?",She mourned for him,She was silent for seven days,She felt guilt and shame,She despised the child,A,I
Questions,2S,11,25,"What was God’s response to what David had done in regard to Uriah and Bathsheba 
(2 Sam 11:27)?",He was angry with David,He was disappointed with Davi d,He was displeased with David,He was ashamed of David,C,I
Questions,2S,12,1,"Who did the Lord send to David to confront him about his sin with Bathsheba (2 Sam 
12:1)?",Gad the seer,Abiathar the priest,Nathan the prophet,Hushai the sage,C,B
Questions,2S,12,2,How did Nathan confront David about his sin with Bathsheba (2 Sam 12:1ff)/,He told him to repent,He told him a story about a rich and poor man,He put dust on his h ead and sat in ashes,He stood shouting it at the city gate,B,B
Questions,2S,12,3,In the parable of Nathan what did the poor man have (2 Sam 12:3)?,A little ewe lamb,A little calf,An only child,A small flock of sheep,A,B
Questions,2S,12,4,In the parable of Nathan how did the poor man treat his little ewe lamb (2 Sam 12:3)?,He feed it from the best of his pastures,It went with him wherever he went,"It slept in its own special pen  
89",It drank from his cup,D,B
Questions,2S,12,5,"When a traveler came to the rich man in Nathan’s parable what did the rich man  do (2 
Sam 12:4)?",He took and slew the poor man’s lamb,He told the traveler to slay the poor man’s lamb,He paid the poor man 5 shekels of silver for the lamb,He took the poor man’s lamb for 5 of his own sheep,A,B
Questions,2S,12,6,In the parable of Nathan to what did he liken the poor man’s ewe lamb (2 Sam 12:3)?,A pearl of great price,A precious friend,A daughter,A son,C,I
Questions,2S,12,7,"All of the followin g were David’s responses to the man who took and slaughtered the 
poor man’s ewe lamb EXCEPT (2 Sam 12:5)",David said he should pay for that lamb four times over,David burned with anger,David said the rich man deserves to die,"David said th e traveler who ate it must leave the city  
  E. David condemned the rich man for not having pity",D,B
Questions,2S,12,8,"After David condemned the rich man in Nathan’s parable what did Nathan say to 
David (2 Sam 12:7)?  
90",Behold the man,You are the man,You mi rror will reveal the rich man,Uriah was the poor man,B,B
Questions,2S,12,9,"In exposing David’s sin God lists all of the following things he had done for David 
EXCEPT (2 Sam 12:7ff)?",Given Goliath into his hands,Anointed him king over Israel,Delivere d him from the hand of Saul,"Gave him the house of Israel and Judah  
  E. Gave him his master’s wives",A,B
Questions,2S,12,10,With what did David kill Uriah the Hittite according to God (2 Sam 12:9)?,The arrow of the Arameans,The seducing of his wife,The sword of the Ammonites,The dagger of Joab,C,B
Questions,2S,12,11,"What did God say would never leave David’s house because of the way he slew 
Uriah (2 Sam 12:10)?",Death,The sword,The curse,"Violence  
91",B,B
Questions,2S,12,12,"What had David done in kill ing Uriah and taking his wife according to God (2 Sam 
12:9)?",Shamed the servants of the Lord,Brought judgment on Israel,Broken the commandments of the Lord,Despised the word of the Lord,D,I
Questions,2S,12,13,"From where did God say he would bring calamity on David for his sin with 
Bathsheba (2 Sam 12:11)?",Out of the people of Israel themselves,Out of his battle with the Ammonites,Out of his own household,In his own palace,C,B
Questions,2S,12,14,What was one judgment on David for his sin with  Bathsheba (2 Sam 12:11)?,His own wives would be taken and defiled in broad daylight,His own wives would be taken when he was out on the battle field,His closest friends would betray him,His own family members would try to kill him,A,B
Questions,2S,12,15,"What was David’s response to Nathan’s parable and confrontation over the sin with 
Bathsheba (2 Sam 12:13)?",I am unclean,"I have sinned against the Lord  
92",I have shamed the one who anointed me,My iniquity is more than I can bear,B,B
Questions,2S,12,16,"Nathan told David that as a result of the Lord taking away David’s sin what would 
not happen (2 Sam 12:13)?",Israel would not be judged,Bathsheba would be forgiven,David would not die,David’s son would be spared,C,B
Questions,2S,12,17,"What would happen as a result of the enemies of the Lord showing utter contempt ( 2 
Sam 12:14)?",David’s family would fall apart,David’s son would try to kill him,David’s would bear the consequence of his sin,"David’s son would die  
D:I:2S: 12 
18. What two things did David do to plead for the life of his child (2 Sam 12:16)?  
 A. Got drunk and solemn  
 B. Fasted and lay on the ground  
 C. Put on sackcloth and put dust on his head  
 D. Sat in ashes and tore his clothes",B,I
Questions,2S,12,19,After how many  days did David’s child with Bathsheba die (2 Sam 12:18)?,"Three  
93",Seven,Twelve,Fourteen,B,I
Questions,2S,12,20,What were David’s servants afraid to tell David (2 Sam 12:18)?,That the Lord was angry with him,That all Israel knew of his sin,The child had died,That Bathsheba was sick unto death,C,B
Questions,2S,12,21,Why were David’s afraid to tell him that the child had died (2 Sam 12:18)?,They were afraid he might burn his palace down,They were afraid he might destroy the ark of God,They were afraid he might no longer be king over Israel,They were afraid he might do something desperate,D,B
Questions,2S,21,22,"What did David do when he found out that his child with Bathsheba was dead (2 Sam 
12:20)?",He tore his clothes and put on sackcl oth,He sat in dust and ashes,He got up washed and ate,He cut himself until the blood flowed,C,B
Questions,2S,21,23,"What did David do when he found out that his child with Bathsheba was dead (2 Sam 
12:20)?  
94",He went into the house of God and worshipped,He sat in dust and ashes,He tore his clothes and put on sackcloth,He cut himself until the blood flowed,A,B
Questions,2S,12,24,"Who questioned David about why he fasted and wept while the child was alive but 
once he got up and ate (2 Sam 12:21)?",Bathsheba,Nathan,His servants,Joab,C,I
Questions,2S,12,25,Why did David fast and weep for the child (2 Sam 12:22)?,"He thought, “Who knows? The Lord may be gracious to me and let the 
child live.”","He thought, “It is I who have sinned and if I re pent the Lord will let him 
live”","He thought, “The Lord is long suffering and merciful he will spare the child 
for his own sake”","He thought, “The child is innocent and so maybe the Lord will take me 
instead of the child”",A,B
Questions,2S,12,26,What was Davi d’s response after the death of his son (2 Sam 12:23)?,"I was sinful at birth, but what has this child done wrong?",I repent in dust and ashes but this child was innocent,"I will go to him but he will not return to me  
95",He is safe in the arms of the shepherd of all people,C,B
Questions,2S,12,27,What was Bathsheba’s second child named (2 Sam 12:24)?,Absalom,Solomon,Tamar,Amnon,B,B
Questions,2S,12,28,Why was Solomon named Jedidiah (2 Sam 12:25)?,Because he would build the temple of God,Because he was the one to replace the son who died,Because in him David found forgiveness,Because the Lord loved him,D,B
Questions,2S,12,29,After the death of David’s child what city did Joab take (2 Sam 12:26)?,Rabbah of the Ammonites,Hesbon of the Amorites,Arnon of the Moabites,Sela of the Edomites,A,A
Questions,2S,12,30,"When did Joab send for David when fighting against the city of Rabbah (2 Sam 
12:27)?",After he had taken the city gate,"After he had broken a whole in the city wall  
96",After he had captured their water supply,After he had burned their fields,C,A
Questions,2S,12,31,What did Joab tell David to do when he was attacking Rabbah (2 Sam 12:28)?,Welcome the troops home into Jerusalem with great celebration,Muster the troops and  besiege the city,Sound the trumpet of victory and announce it to the people of Israel,Bring the sword of Goliath to cut off the head of the king of Rabbah,B,I
Questions,2S,12,32,"Why did Joab send and tell David to muster the troops and attack the city of R abbah 
(2 Sam 12:28)?",Otherwise Joab would take the city and they would name it after him,Otherwise the city would be burned down and there would be no plunder,Otherwise Joab would be taken by the troops and made the king of Israel,Otherwise  David would be seen as a coward,A,I
Questions,2S,12,33,After taking Rabbah what symbolic gesture did David do (2 Sam 12:30)?,Took the head of the king of Rabbah back to Jerusalem,Burned the city with fire and sowed it with salt never to be rebuilt,Put the crown of the king of Rabbah on his head,Dragged the men of Rabbah through the streets,C,I
Questions,2S,12,34,What did David do to all the Ammonite towns (2 Sam 12:31)?,"Burned them to the ground  
97",Made them pull plows for the Israelites instead o f oxen,Made them carry water and hew trees for the Israelites,Made them labor at brickmaking and labor with saws and iron picks,D,I
Questions,2S,12,35,"What were the picks made out of that David had the captives of Rabbah labor with (2 
Sam 12:31)?",Bronz e,Copper,Iron,Steel,C,A
Questions,2S,13,1,Who was the son of David that fell in love with David’s daughter Tamar (2 Sam 13:1)?,Absalom,Amnon,Adonijah,Nathan,B,B
Questions,2S,13,2,"Who wa s the daughter of David that Amnon the son of David fell in love with (2 Sam 
13:1)?","Ahinoam  
  B  Abigail  
  C.  Maacah  
 D. Tamar   
D:B:2S:13  
3. Who was Tamar’s brother by David and the same mother (2 Sam 13:1)?  
 A. Absalom",Amnon,Adonijah,Nathan,A,B
Questions,2S,13,4,Why was Amnon frustrated to the point of illness (2 Sam 13:2)?,Because Tamar was his sister,Because Tamar was a virgin and he couldn’t do anything to her,"Because Tamar was one of the kings servants and beyond his control  
99",Because Amnon feared Tamar’s brother Absalom,B,I
Questions,2S,13,5,Who was the shrewd friend who plotted to entrap Tamar with Amnon (2 Sam 13:3)?,Eliam son of Ahithophel,Heled son of Baanah,Jonadab son of Shimeah,"Eliahba the son of Jashen  
C:B:2S: 13 
6. What was the relationship of Jonadab son of Shimeah to David (2 Sam 13:3)?  
 A. His son -in-law 
 B. His cousin  
 C. His brother -in-law 
 D. His nephew",D,A
Questions,2S,13,7,What plot did Jonadab hatch to entrap Tamar (2 Sam 13:5)?,For Amnon to pretend he was  sick and ask for Tamar to prepare his food,"For Amnon to pretend he was going into battle and Tamar was to send him 
off",For Amnon to pretend he needed instruction from Tamar,"For Amnon to get David to leave Jerusalem for three days so he could have 
his way with Tamar",A,B
Questions,2S,13,8,"Where did David send word to Tamar to go to the house of Amnon and prepare food 
for him (2 Sam 13:7)?","At the Gate of Benjamin  
100",At the spring of Gihon,At the palace,At Tamar’s home on the Mount of Ol ives,C,I
Questions,2S,13,9,Where was Amnon pretending to be sick (2 Sam 13:8)?,At his own house,At David’s palace,At the house of Jonadab,At the spring of Gihon,A,I
Questions,2S,13,10,What did Tamar prepare in front of Amnon but he refused to take it (2 Sam 13:8f)?,Figs,Mixed wine,Roasted lamb,Bread,D,I
Questions,2S,13,11,What did Amnon do prior to assaulting Tamar (2 Sam 13:9)?,Tied her up,Ate the food she had prepared,Sent everyone out,Closed the windows and doors,C,B
Questions,2S,13,12,Whe re did Amnon tell Tamar to bring the food she had prepared (2 Sam 13:10)?,"Into the doorway of his house  
101",Into the bedroom of his house,Onto the roof top of his house,Onto the porch of his house,B,B
Questions,2S,13,13,Instead of taking her bread what did Amnon say to Tamar (2 Sam 13:11)?,Come to bed with me,Close the door behind you,Where is your brother Absalom?,My heart his heavy longing for you,A,I
Questions,2S,13,14,"Tamar resisted Amnon telling he would be like what if he violated  her (2 Sam 
13:13)?",A despised dog,A ravenous vulture,A wicked fool,A donkey,C,I
Questions,2S,13,15,What suggestion did Tamar make to Amnon (2 Sam 13:13)?,He get some help from the king’s advisors,He take one of the other handmaids of the  palace,He ask her instead of forcing her,He ask the king for her in marriage,D,B
Questions,2S,13,16,"What did Amnon do to his half -sister Tamar (2 Sam 13:14)?  
102",He raped her,He tortured her,He beat her,He poisoned her,A,B
Questions,2S,13,17,What did Amnon do after he violated his sister Tamar (2 Sam 13:15)?,He complained to David about her,He gave her to Jonadab,He forced her to leave,He asked for her hand in marriage,C,B
Questions,2S,13,18,What did Tamar say was worse than being raped by Am non (2 Sam 13:16)?,His hitting her,His sending her away,His exposing her to shame,His rejection of her offer of marriage,B,B
Questions,2S,13,19,Who actually put Tamar out and bolted the door (2 Sam 13: 18)?,Amnon,Jonadab,Joab,Amno n’s servant,D,I
Questions,2S,13,20,"How did Tamar respond after Amnon threw her out (2 Sam 13:19)?  
103",She went and told David all that had happened,She would not eat or drink,She tore her robe and put ashes on her head,She lamented on the walls of Jeru salem,C,B
Questions,2S,13,21,"Who advised Tamar to be quiet after being raped by her half -brother Amnon (2 Sam 
13:20)?",Joab,Absalom,Jonadab,David,B,B
Questions,2S,13,22,"Where did Tamar go to live after being violated by Amnon her half -brother (2 Sam 
13:20)?",In the palace of the king,Outside the city gate,In the home of Absalom,Beside the tabernacle of the Lord,C,B
Questions,2S,13,23,What was David response when he heard of the rape of Tamar (2 Sam 13:21)?,He was furious but did nothing,He was broken hearted and wept,He gave Tamar a permanent place in the palace,He gave Tamar a special ornamental robe to wear,A,B
Questions,2S,13,24,What was Absalom’s initial response to the rape of his sister Tamar (2 Sam 13:21)?,He was furious and v owed to kill Amnon,He did not say a word to Amnon whom he hated,He began gathering troops to go against Amnon,He provided Tamar with a veil to express her mourning,B,B
Questions,2S,13,25,When did Absalom hatch his plot to kill Amnon (2 Sam 13:23)?,Three months later,A year later,Two years later,Three years later,C,A
Questions,2S,13,26,Where is Baal Hazor (2 Sam 13:23)?,Near the border of Judah,Near the Gilgal,Next to Bethel and Ramah in Benjamin,Near the border of Ephraim,D,A
Questions,2S,13,27,When did Absalom hatch his plot to kill Amnon (2 Sam 13:23)?,When his sheep shearers were at Baal Hazor,When his reapers were at the threshing floor at Gibeon,At the time of the festival of Trumpets,After the barley harvest,A,I
Questions,2S,13,28,"Who did Absalom invite to Baal Hazor when the sheepshearers were there (2 Sam 
13:23)?",All Israel,All the leaders of Judah,All the kings sons,All the city of Baal Hazor,C,B
Questions,2S,13,29,"Who did Absalom urge to come to his sheepshearing in Baal Hazor but he refused (2 
Sam 13:25)?",Joab,David,Amnon,Tamar,B,I
Questions,2S,13,30,When did Absalom instruct his men to kill Amnon (2 Sam 13:28)?,When he went up to the altar to offer a sacrifice,When he sat to eat the  lambs that had been sheared,When he was alone after the meal had ended and the guest had gone,When he was in high spirits from drinking wine,D,B
Questions,2S,13,31,After Amnon was killed what did the other sons of the king do (2 Sam 13:29)?,They wept for Amnon,They all bowed in respect and fear to Absalom,They mounted their donkeys and fled,"They ordered their guards to bury Amnon’s body  
106",C,B
Questions,2S,13,32,"What report initially came to David after the slaying of Amnon for raping Tamar (2 
Sam 13:30)?",The Philistines had attacked and carried off David’s sons,Joab had slain Amnon,All the kings sons had been struck down,Amnon had been killed by Absalom,C,B
Questions,2S,13,33,"What was David’s initial response when he was told all his sons h ad been killed right 
after Amnon was slain (2 Sam 13:31)?",He tore his clothes and lay on the ground,He when to the house of the Lord to pray,He when up to the roof of his house and stretched out his hands to the Lord,He ordered Joab to go o ut and find out what had happened,A,I
Questions,2S,13,34,Who told David that all his sons were not killed but only Amnon (2 Sam 13:32)?,Joab son of Zeruiah,Jonadab son of Shimeah,Jonathan son of Shammah,Ira son of Ikkesh,B,I
Questions,2S,13,35,"What did Absal om do after slaying Amnon for the rape of his sister Tamar (2 Sam 
13:37)?",Came into Jerusalem riding his royal donkey,"Went to the En Rogel spring to wash his hands  
107",Fled to the land of Geshur,Went to Egypt to avoid David’s wrath,C,A
Questions,2S,13,36,"How did David sons who had not been killed by Absalom enter Jerusalem (2 Sam 
13:36)?",Fearing for their lives,Angry at what Absalom had done,Plotting how to kill Absalom,Wailing loudly,D,I
Questions,2S,13,37,To whom did Absalom flee after killing Amnon (2 Sam 13:37)?,"Talmai son of Ammihud, king of Geshur",Ithai son of Ribai king of Geshur,Igal son of Zobah king of Geshur,Abiezer son of Baanah king of Damascus,A,I
Questions,2S,13,38,"Three years after Absalom had killed Amnon, what were  David’s feelings toward 
Absalom (2 Sam 13:38)?",He was still furious over what Absalom had done,He was wanting to send Joab after him to capture him in Geshur,He longed to go to Absalom,He wanted Absalom to come home,C,I
Questions,2S,14,1,Who knew that David’s heart longer for Absalom (2 Sam 14:1)?,Bathsheba,Nathan the prophet,Joab his commander,Hushai his advisor,C,B
