book_name,book_code,chapter,question_number,question,option_a,option_b,option_c,option_d,correct_option,difficulty
2Kings,2K,17,36,"When the lions attacked the people who had been deported to Samaria who did they 
raise this issue with (2 Kgs 17:26)?",The priests of Samaria,The elders of Samaria,Hoshea king of Samaria,The king of Assyria,D,I
2Kings,2K,17,37,"What solution did the king of Assyria propose to solve the problems of lions killing 
people in Samaria (2 Kgs 17:27)?",The city walls be rebuilt to protect the people from the lions,Soldiers be sent in to kill the lions in the land of Israel,A priest of the Lord be sent to teach the people what he requires,"A prophet of the Lord be sent back and the people repent  
164",C,B
2Kings,2K,17,38,"Where did each national group brought in to repopulate Israel worship their own gods 
(2 Kgs 17:29)?",At the shrines on the high places the people of Israel had built,In the valleys  where the altars of Baal were,In the trees where the Asherah poles were set up,In every city where the Israel’s had been taken and deported to Assyria,A,B
2Kings,2K,17,39,Who burned their children in the fire as sacrifices to Adrammelech (2 Kgs 17:31)?,The Avvites,The Sepharvites,The Babylonians,The men of Cuthah,B,A
2Kings,2K,17,40,"While those brought in to repopulate the land of Israel worshipped their own gods 
who did they also worship (2 Kgs 17:35)?",Chemosh,Moloch,Dagon,The Lord,D,B
2Kings,2K,17,41,"What did the Lord command the Israelites when he made a covenant with them 
according to 2 Kgs 17 (2 Kgs 17:35)?",Do not take the name of the Lord your God in vain,"Do not worship any other gods  
165",Do not make idols,Do not kill,B,B
2Kings,2K,17,42,"What redemptive event did the author of 2 Kings 17 cite as demanding that other 
gods should not be worship but only the Lord alone (2 Kgs 17:36)?",He defeated the Canaanites who were in the land,He p arted the Red Sea for them,He brought them up out of Egypt,He fed them manna in the wilderness,C,B
2Kings,2K,17,43,How did the writer of 2 Kings 17 say God brought Israel out of Egypt (2 Kgs 17:36)?,With an outstretched arm,With a pillar of fire,With the death of Pharaoh’s fireborn,Through parting the Red Sea,A,I
2Kings,2K,17,44,"What benefit did the writer of 2 Kings list that would accrue from worshipping the 
Lord (2 Kgs 17:39)?",He would kill all their enemies,He would provide food an d protection,"He would deliver them from all their enemies  
 B. He would bless and multiply them  
C:I:2K;17  
45. What do the descendants of those brought into Israel by the Assyrias do (2 Kgs 
17:41)?  
166 
 
 A. They rejected the Lord and served Baal  
  B. They wor shipped the Lord and served their idols  
 C. They rebuilt the high places",They burned their children in the fire,B,B
2Kings,2K,18,1,"Who took over in Judah in the third year of Hoshea the final king of Israel (2 Kgs 
18:1)?",Jotham,Manasseh,Hezekiah,Josiah,C,B
2Kings,2K,18,2,When Hezekiah became king in Judah who was king in Israel (2 Kgs 18:1)?,Menahem,Pekah,Jehoram,Hoshea,D,I
2Kings,2K,18,3,How old was Hezekiah when he became  king of Judah (2 Kgs 18:2)?,16,21,25,29,C,A
2Kings,2K,18,4,How many years did Hezekiah reign in Jerusalem (2 Kgs 18:2)?,22 years,29 years,"32 years  
168",40 years,B,A
2Kings,2K,18,5,What was Hezekiah’s mother’s name (2 Kgs 18:2)?,Abijah,Abishag,Abigail,Ahinoam,A,A
2Kings,2K,18,6,What was the opening evaluation of Hezekiah’s reign (2 Kgs 18:3)?,He did what was evil in the eyes of the Lord,He did what was right as his father David had done,He did what was right but not as his father David had done,He did what was right but did not destroy the high places of Judah,B,B
2Kings,2K,18,7,It is recorded that Hezekiah did all of the following EXCEPT (2 Kgs 18:4)?,Repaired the temple of the Lord,Removed all the high pla ces,Smashed the sacred stones,Cut down the Asherah poles,A,B
2Kings,2K,18,8,What did Hezekiah break in pieces that went back to the time of Moses (2 Kgs 18:4)?,The pot of manna,The ten commandments,"The altar of incense  
169",The bronze snake,D,B
2Kings,2K,18,9,What was called “Nehustan” in the time of Hezekiah (2 Kgs 16:4)?,The Asherah pole in Jerusalem,The altars on the high places of Judah,Moses’ bronze snake,The priests of foreign gods,C,I
2Kings,2K,18,10,What did Hezekiah keep (2 Kgs 18:6)?,The commands the Lord had given to Moses,The ways of the Lord,The feasts and sacrifices commanded by Moses,The wise ways of Solomon king of Israel,A,B
2Kings,2K,18,11,What is coupled with the fact that the Lord was with Hezekiah (2 K gs 18:7)?,He honored the Lord by repairing the temple,He was successful in whatever he did,God renewed the covenant with Hezekiah,He had many sons and daughters,B,I
2Kings,2K,18,12,Whose rule did Hezekiah rebel against (2 Kgs 18:7)?,The ki ng of Aram,The Pharaoh of Egypt,"The king of Assyria  
170",The king of Babylon,C,B
2Kings,2K,18,13,"Who did Hezekiah defeat from the watch tower to the fortified city and Gaza (2 Kgs 
18:8)?",The Philistines,The Edomites,The Moabites,The Arame ans,A,A
2Kings,2K,18,14,"What happened in the fourth year of Hezekiah and seventh year of Hoshea king of 
Israel (2 Kgs 18:9)?",Tiglath -pileser king of Assyria attacked Samaria,Shalmaneser king of Assyria laid siege to Samaria,Sennacherib king of Assyri a attacked Jerusalem,Nebu -zaradan the commander of the Babylonian army attacked Dan,B,B
2Kings,2K,18,15,How long did the Assyrians lay siege to Samaria before taking it (2 Kgs 18:10)?,6 months,1 year,2 years,3 years,D,B
2Kings,2K,18,16,What did the king of Assyria do to Israel after capturing Samaria (2 Kgs 18:11)?,He deported the people to Assyria,"He slew all the people of Samaria  
171",He burned the city to the ground,He broke down the walls of Samaria,A,B
2Kings,2K,18,17,The Israelites were deported to all of the following regions EXCEPT (2 Kgs 18:11)?,Halah,Gozan on the Habor River,Susa of the Persians,Into the towns of the Medes,C,A
2Kings,2K,18,18,Why does the text explicitly say that Israel was carried off to Ass yria (2 Kgs 18:12)?,Because they built Asherah poles in Samaria,Because they broke God’s covenant,Because they served the bronze snake Moses had built,Because they killed the prophets,B,B
2Kings,2K,18,19,Who came up against Hezekiah in his fourt h year (2 Kgs 18:13)?,Tiglath -Pileser of Assyria,Shalmaneser of Assyria,Sennacherib of Assyria,"Nebu -zaradan of Babylon  
 E. Cyrus the Persian",C,B
2Kings,2K,18,20,Where did Hezekiah send a message to Sennacherib king of Assyria (2 Kgs 18:14)?,"At Nineveh  
172",At Beth Zur,At Gilgal,At Lachish,D,A
2Kings,2K,18,21,What did Hezekiah offer Sennacherib to leave Judah (2 Kgs 18:14)?,"100,000 sheep and 5,000 oxen","5,000 bushels of wheat and 1,000 gallons of wine",300 talents of sil ver and 30 talents of gold,100 chariots and 300 horses,C,I
2Kings,2K,18,22,"Where did Hezekiah get the silver to give to Sennacherib to get him to leave Judah (2 
Kgs 18:1)?",From the temple of the Lord and in the royal palace treasuries,From the wealt hy among those who lived in Jerusalem,From the taxes of the people that were stored in the store house at Jericho,From the people of the town of Lachish,A,B
2Kings,2K,18,23,"Where did Hezekiah get the gold he gave to Sennacherib to leave Judah (2 Kgs 
18:16)?",From the royal treasuries,From the gold that covered the doors and doorposts of the temple,From the table in the royal palace,From the golden shields Solomon had built,B,I
2Kings,2K,18,24,"The king of Assyria sent all of these to confront H ezekiah EXCEPT (2 Kgs 18:17)?  
173",His chief officer,His field commander,His court recorder,His supreme commander,C,A
2Kings,2K,18,25,"Where did Sennacherib’s officials call from to meet with the king of Judah 
(Hezekiah) (2 Kgs 18:17)?",The Gihon Spring,The Siloam tunnel,The Corner Gate by the Hinnom Valley,The aqueduct of the Upper Pool,D,A
2Kings,2K,18,26,"The aqueduct of the Upper Pool in Jerusalem is on the road to _________ (2 Kgs 
18:17)?",The Field of Blood,The Potter’s F ield,The Washerman’s Field,The Tanner’s Gate,C,A
2Kings,2K,18,27,"All of the following went out from Jerusalem to meet with Sennacherib’s officials 
EXCEPT (2 Kgs 18:18)?",Eliab the commander of the gurad,Eliakim son of Hilkiah the palace administ rator,Shebna the secretary,"Joah son of Asaph the recorder  
174",A,A
2Kings,2K,18,28,"The field commander of Sennacherib sent a message challenging Hezekiah about not 
trusting in _______ (2 Kgs 18:21)?",Babylon,Aram,Edom,Egypt,D,B
2Kings,2K,18,29,What c ountry did the Assyrian officials refer to as a splintered reed (2 Kgs 18:21)?,Babylon,Aram,Edom,Egypt,D,I
2Kings,2K,18,30,"What did the Assyrian officials say Hezekiah had done against the Lord and therefore 
not to put confidence in his deliverance (2 Kgs 18:22)?",Hezekiah took the gold from the Lord’s temple,Hezekiah removed his high places and altars,Hezekiah had killed the priests of the Lord,Hezekiah had destroyed the bronze snake of Moses,B,B
2Kings,2K,18,31,"What demand did  Hezekiah make on the people which the king of Assyria was aware 
(2 Kgs 18:22)?",The people must pay their silver and gold to Hezekiah,"The people must give up their idols  
175",The people but worship only at the altar in Jerusalem,The people of L achish were to be sacrificed for Jerusalem,C,B
2Kings,2K,18,32,What “bargain” did the officials of Sennacherib propose to Hezekiah (2 Kgs 18:23)?,"He would give Hezekiah 2,000 horses if he could put riders on them",He would give Hezekiah 3 days to flee fro m Jerusalem,"He would give Hezekiah 100 chariots to fight against a single officer of 
Sennacherib",He would allow Hezekiah to come out and gather all the food he needed,A,B
2Kings,2K,18,33,What did Sennacherib say that Hezekiah was depending on Egypt for ( 2 Kgs 18:24)?,Food and troops,Chariots and horsemen,Spears and bows,"Reinforcements  
B:I:2K;18  
34. With what authority was Sennacherib coming to attack Jerusalem according to the 
officials (2 Kgs 18:25)?  
 A. The gods of the idols Hezekiah had destroyed told him to come against 
Judah  
  B.  The people of Israel who had be scattered to Israel told him to attack  
 C. He was told by the Lord to march against Judah  
 D. His god Adrammalon had sent him against Judah",C,B
2Kings,2K,18,35,"What reque st to the Assyrian officials did Eliakim, Shebna and Joah make (2 Kgs 
18:26)?",The Assyrian officials speak to them in Aramaic rather than Hebrew,"The Assyrian officials allow the women and children to leave before they 
attack",The Assyrian offic ials not boast of what they could not deliver,The Assyrian officials tell Sennacherib his days were numbered,A,B
2Kings,2K,18,36,"Why did Eliakim, Shebna and Joah ask the Assyrian officials to speak in Aramaic (2 
Kgs 18:26)?",So that Sennacherib could und erstand the demands of the Lord,To show that the leaders of Judah were aware of the Assyria culture,So the people on the walls of Jerusalem would not hear it,So their communication would be absolutely clear,C,B
2Kings,2K,18,37,What did the Assyrian officials say the people on the wall would do (2 Kgs 18:27)?,Eat their own children,Die of starvation and be eaten by birds,Be killed by the sword and not buried,Eat their own filth and drink their own urine,D,I
2Kings,2K,18,38,"What request did the Assyrian officials make directly to the people on the walls of 
Jerusalem (2 Kgs 18:31)?",To come out of the city and make peace with him,"Give up their fight and escape with the clothes on their back  
177",Give him all the gold and silver in the ci ty,Throw him the head of Hezekiah and he would leave,A,I
2Kings,2K,18,39,"The king of Assyria promised all of the following to the people who came out and 
sought peace EXCEPT (2 Kgs 18:31)",Everyone would eat from his own vine,Everyone would eat from his own olive tree,Everyone would eat from his own fig tree,"Everyone would drink water from his own cistern  
B:B:2K;18  
40. The king of Assyria described the land where he would take the people of Judah in all 
of the following ways EXCEPT(2 Kgs 18:32)?  
 A.  A land of grain  
 B. A land of new wine and bread  
 C. A land of olive trees and honey  
 D. A land of milk and honey",D,B
2Kings,2K,18,41,"The king of Assyria asked all of the following rhetorical question seekign  to get the 
people of Judah to surrender  EXCEPT ( 2 Kgs 18:34)?","Who of all the gods of these coutnries has been able to save his land from 
me?",How can the Lord deliver Jerusalem from my hand?,Where are the gods of Hamath and Arpad?,How can your feeble walls stand up to the gods of Assyria?,D,B
2Kings,2K,18,42,What reply did the king tell the people to make to Sennacherib (2 Kgs 18:36)?,They exclaimed “the Lord is king”,They were silent,They sent word back that they would not surrender,They raised their spears and s words,B,I
2Kings,2K,19,1,What was Hezekiah’s initial reaction to Sennacherib’s demands (2 Kgs 19:1)?,He fortified the city,He tore his clothes and put on sackcloth,He reinforced the gates of the city of Jerusalem,Shaved his head and was silent for three days,B,B
2Kings,2K,19,2,"To whom did Hezekiah send Eliakim and others after receiving the demands of 
Sennacherib king of Assyria (2 Kgs 19:2)?",Ezekiel son of Buzi,Hosea son of Be eri,Micah of Moresheth,Isaiah son of Amoz,D,B
2Kings,2K,19,3,Hezekiah sent all of the following to Isaiah son of Amoz EXCEPT (2 Kgs 19:2)?,Eliakim the palace administrator,Gemariah the recorder,Shebna the secretary,The leading priests,B,I
2Kings,2K,19,4,"To what did Hezekiah liken the day he received the demands of Sennacherib king of 
Assyria to Isaiah son of Amoz (2 Kgs 19:3)?",The death of a father who was loved by his family,"When a young person’s strength has been spent because they ha ve no water 
in the desert  
180","When children come to the point of birth but there is no strength to deliver 
them",A bird caught in the snare of the hunter,C,I
2Kings,2K,19,5,For whom did Hezekiah ask Isaiah the son of Amoz to pray for (2 Kgs 19:4)?,The r emnant that still survives,The women and children of Judah,The temple of the Lord his God,Those who are innocent having done neither right nor wrong,A,B
2Kings,2K,19,6,What did Hezekiah tell Isaiah son of Amoz he was hoping for (2 Kgs 19:4)?,"That God would raise up a deliverer to deliver them from the hand of 
Sennacherib",That God would send a hailstorm to destroy the armies of Sennacherib,That God would have mercy on his people,That God heard the ridicule and would rebuke Sennache rib for his words,D,I
2Kings,2K,19,7,"What did Isaiah son of Amoz tell Hezekiah that God had said concerning 
Sennacherib’s coming attack of Jerusalem (2 Kgs 19:5)?",Throw down the altars of Baal,Do not be afraid,I am with you,Repent and worship the Lord your God,B,I
2Kings,2K,19,8,"What did Isaiah son of Amoz tell Hezekiah God would do to deliver the city of 
Jerusalem (2 Kgs 19:7)?","Sennacherib would be defeated by the armies of the Philistines and 
Edomites","Sennacherib would hear the Babylonian s were attacking Nineveh and he 
would withdraw","Sennacherib would hear a report and return to his country where he would 
be killed",Sennacherib would become sick and have to withdraw,C,B
2Kings,2K,19,9,"What did Isaiah the son of Amoz tell Hezekiah of the  sin that God was upset with 
Sennacherib about (2 Kgs 19:6)?",He had thought that he was a god,He had blasphemed God,He had harmed God’s people,His arrogance would be punished,B,B
2Kings,2K,19,10,After leaving Lachish where was the king of Assyri a fighting in Judah (2 Kgs 19:8)?,Libnah,Beth Zur,Hebron,Keilah,A,A
2Kings,2K,19,11,Who did Sennacherib hear was coming to fight against him (2 Kgs 19:9)?,Pharoah Necho king of Egypt,"Nebu -zaradan the chief general of Babylon  
182",Tirhakah the Cushite king of Egypt,Rezin king of Aram,C,B
2Kings,2K,19,12,"When the king of Assyria sent Hezekiah a letter he said the gods of this people in Tel 
Assar had not delivered them from his hand (2 Kgs 19:12)?",The people of Ammon,The people of Haran,The people of Damascus,The people of Eden,D,A
2Kings,2K,19,13,"All of the following were listed in Sennacherib’s letter to Hezekiah as defeated kings 
EXCEPT (2 Kgs 19:13)?",The king of Damascus,The king of Hamath,The king of Arpad,"The king of the city of Sepharvaim  
 E. The king of Ivvah",A,A
2Kings,2K,19,14,"What did Hezekiah do with the letter he received from Sennacherib king of Assyria (2 
Kgs 19:14)?",He burned the letter on the incense altar in the temple of the Lord,He read i t to the people,He took it and spread it out before the Lord,He cut it to pieces and sent it back to Sennacherib,C,B
2Kings,2K,19,15,"In his prayer over the letter of Sennacherib where did Hezekiah say the Lord was 
enthroned (2 Kgs 19:15)?",Between th e cherubim,In the holy of holies,On the praises of Israel,In the heaven of heavens,A,B
2Kings,2K,19,16,"In Hezekiah’s prayer to God how did he the letter Sennacherib had sent (2 Kgs 
19:16)?",As blaspheme against the Lord God of Judah,As a piece of chaff speaking to a cedar tree,As dust blown in the wind,As an insult to the living God,D,I
2Kings,2K,19,17,"What did Hezekiah say in his prayer that Sennacherib had done to gods of the nations 
(2 Kgs 19:18)?",Defiled them and hung them on t he city wall,Thrown them into the fire and destroyed them,Smashed them under a millstone grinding them to dust,Dragged them through the streets behind his chariot,B,A
2Kings,2K,19,18,"On what basis does Hezekiah called for God to deliver Jerusalem fr om Sennacherib 
in his prayer after receiving Sennacherib’s letter (2 Kgs 19:19)?",So that your people may praise your name and celebrate your Sabbaths,"So that sacrifices and incense may be burned in your honor  
184",So that all kingdoms on earth may know that you alone are God,So that all the nations may see your power and revere your name,C,I
2Kings,2K,18,19,"After receiving Sennacherib’s message and praying who sent Hezekiah a message (2 
Kgs 19:20)?",Eliakim son of Hilkiah,Shebna the secretary,Joah the son of Asaph,Isaiah son of Amoz,D,B
2Kings,2K,19,20,"What did the Lord through Isaiah call Zion in his response to Hezekiah’s prayer (2 
Kgs 19:21)?",The Mountain of the Lord,The Virgin Daughter of Zion,The wife of the Lord,Zion the city of David,B,I
2Kings,2K,19,21,When does Isaiah say Zion will mock Sennacherib and toss her head (2 Kgs 19:21)?,As Sennacherib flees,As Sennacherib dies,As Sennacherib loses his army,As Sennacherib bows before the Lord,A,B
2Kings,2K,19,22,"What title is God given in God’s response to Hezekiah’s prayer after receiving 
Sennacherib’s letter (2 Kgs 19:22)?  
185",The Mighty One of Israel,The Holy One of Israel,El Shaddai,The Lord of Hosts,B,A
2Kings,2K,19,23,"In God’s response to Hezekiah’s prayer he gives an imagined speech by Sennacherib 
bragging he has done what (2 Kgs 19:23)?",On my stallions conquered all who have opposed me,Humbled the mighty ones of Lebanon,Burned to dust and ashes the high places of Aram,With my chariots a scended the heights of the mountains,D,A
2Kings,2K,19,24,"In God’s response to Hezekiah’s prayer he gives an imagined speech by Sennacherib 
bragging he has done what in foreign lands (2 Kgs 19:23)?",Broken down high places,Dug wells and drunk the water,Built fortresses to defend the helpless,Humbled the kings of foreign lands,B,A
2Kings,2K,19,25,"In God’s response to Hezekiah’s prayer he gives an imagined speech by Sennacherib 
bragging he has done what with the soles of his feet (2 Kgs 19:2 4)?",Dried up the streams of Egypt,Shaken the mountains of Lebanon,Scaled the highest of Ephraim,"Trampled on his enemies from Hamath to Ezion -geber  
186",A,B
2Kings,2K,19,26,"In God’s response to Hezekiah’s prayer what does God say he has have the king of 
Assyr ia bring to pass (2 Kgs 19:25)?",You have ground to dust the bones of your enemies,You have burned to the ground the foreign temples,You have turned fortified cities into piles of stone,You have ripped open the women of Aram,C,I
2Kings,2K,19,27,"In God’s response to Hezekiah’s prayer he describes those whom Sennacherib has 
defeated under God’s plan as ________ (2 Kgs 19:23)?",Empty cisterns that hold no water,Grass sprouting on the roof scorched,Ants trampled on by chariot wheels,Chaff blown away by the wind,B,I
2Kings,2K,19,28,"In God’s response to Hezekiah’s prayer he describes Sennacherib as doing what 
against him (2 Kgs 19:28)?",Raging against him,Mocking him,Fighting against him,Killing his beloved,A,I
2Kings,2K,19,29,"In G od’s response to Hezekiah’s prayer he describes himself as making Sennacherib 
return with what types of things (2 Kgs 19:28)?","A lease around your neck  
187",A ring in your ear,A hook in your nose,A sword through your heart,C,I
2Kings,2K,19,31,What did God give Hezekiah as a sign (2 Kgs 19)?,This year your cisterns will be full,This year you will eat what grows by itself,This year you will see the Assyrians no more,This year you will get manna from heaven,B,B
2Kings,2K,19,32,"What yea r did God tell Hezekiah he was to sow and reap, plant vineyards and eat 
their fruit (2 Kgs 19:29)?",This year,The second year,The third year,The fourth year,C,I
2Kings,2K,19,33,"In God’s response to Hezekiah’s prayer what does he say will come out of Mount 
Zion (2 Kgs 19:31)?",A band of priests,A band of brothers,A host of followers of the Lord,A band of survivors,D,B
2Kings,2K,19,34,"In God’s response to Hezekiah’s prayer what does he say will come out of Jerusalem 
(2 Kgs 19:31)?",A rem nant,A band of brothers,A host of followers of the Lord,The tribe of Judah,A,B
2Kings,2K,19,35,What will accomplish bringing a remnant out of Jerusalem (2 Kgs 19:31)?,The hand of the Lord,The reign of righteousness upon the earth,The zeal of the Lord Almighty,The wrath of the Lord of hosts,C,I
2Kings,2K,19,36,"God encouraged Hezekiah that the king of Assyria would not do any of the following 
against Jerusalem EXCEPT (2 Kgs 19:32)?",He will not enter the city,He will not shoot an ar row there,"He will not build a siege ramp against it  
189",He would not burn down the temple,D,A
2Kings,2K,19,37,Why did God say he would defend the city of Jerusalem (2 Kgs 19:34)?,For the sake of the remnant,For the sake of David his servant,For the sake of his beloved Judah,For the sake of the righteous still living in Jerusalem,B,I
2Kings,2K,19,38,Who put to death the Assyrian army (2 Kgs 19:35)?,The arch angel Gabriel,A hail storm sent by the Lord,The angel of the Lord,The outstre tched arm of the Lord,C,I
2Kings,2K,19,39,How many Assyrians died as a result of the angel of the Lord (2 Kgs 19:35)?,"50,000","125,000","165,000","185,000",D,B
2Kings,2K,19,40,"Where did Sennacherib return to after his troops were struck down by the angel of the 
Lord (2 Kgs 19:36)?",Damascus,"Samaria  
190",Nineveh,Kalneh,C,B
2Kings,2K,19,41,Who killed Sennacherib (2 Kgs 19:37)?,The commander of the army,His sons,The officials of the city of Nineveh,The guard at the gate,B,B
2Kings,2K,19,42,When di d Sennacherib’s sons kill him (2 Kgs 19:37)?,When he was drawing water from a well,When he was feasting in Nineveh,When he was worshipping in the temple of his god,When he went out to fight against the Babylonians,C,B
2Kings,2K,19,43,Who succeed ed Sennacherib as king of Assyria (2 Kgs 19:37)?,Shalmaneser,Shamsi -adad,Tiglath -Pileser,Esarhaddon,D,B
2Kings,2K,19,44,"What was the name of Sennacherib’s god who he was worshipping when his sons 
killed him (2 Kgs 19:37)?","Marduk  
191",Nisroch,Moloch,Dagon,B,A
2Kings,2K,20,1,Who went to Hezekiah when he was ill to the point of death (2 Kgs 20:1)?,Joah son of Asaph,Eliakim son of Hilkiah the priest,Isaiah son of Am oz,Shebna the secretary,C,B
2Kings,2K,20,2,What did Isaiah tell Hezekiah to do in light of his impending death (2 Kgs 20:2)?,Put his house in order,Take down the Asherah pole in Jerusalem,Repair the temple of the Lord,Lead his people in a day  of fasting,A,B
2Kings,2K,20,3,"Hezekiah did all of the following when Isaiah told him he would die and not recover 
EXCEPT (2 Kgs 20:2)",Turned to the wall,Fasted,Prayed,Wept bitterly,B,B
2Kings,2K,20,4,"What did Hezekiah ask God to remember when Isaiah t old him he was going to die (2 
Kgs 20:2)?",His loving kindness,His mercy,"How he had ground to dust the bronze serpent idol  
193",That he had walked before God faithfully,D,I
2Kings,2K,20,5,What did God tell Isaiah to do after Hezekiah’s prayer (2 Kgs 20:5)?,Tell Hezekiah that he must make a copy of the law before he dies,Tell Hezekiah God had seen his tears and would heal him,Tell Hezekiah that he had seven weeks longer to live,Tell Hezekiah to repent and serve the Lord,B,B
2Kings,2K,20,6,How long did God say he would add onto Hezekiah’s life (2 Kgs 20:6)?,6 months,2 years,7 years,15 years,D,B
2Kings,2K,20,7,God promised Hezekiah he would deliver Jerusalem from whose hand (2 Kgs 20:6)?,The king of Babylon,The king of Moa b,The king of Assyria,The king of Aram,C,B
2Kings,2K,20,8,Why did God say he would defend Jerusalem from the king of Assyria (2 Kgs 20:6)?,As a punishment on the king of Assyria,For the sake of my servant David,"For the sake of ten righteous p eople who live there  
194",For the sake that Hezekiah had walked before the Lord always,B,A
2Kings,2K,20,9,"What did God say he had seen which resulted in him telling Hezekiah he would heal 
him (2 Kgs 20:5)?  
  Av. His repentance  
  Bx. His concern for God’s people  
 C. His tears  
 D. His loyalty to God  
C:B:2K:20  
10. What did Isaiah say to do to care for Hezekiah’s deadly boil (2 Kgs 20:7)?",Make a poultice of figs,Make a poultice of olives,Put on it ashes from the incense altar,Burn it with an ir on rod,A,A
